{
 "capsule_id": "karamba_beam_v1",
 "version": 1,
 "capability": "analyze",
 "structure_type": "beam",
 "plugin_dependencies": [
  {
   "name": "Karamba3D",
   "min_version": "3.1"
  }
 ],
 "definition_file": "01_SimpleBeam.ghx",
 "title": "Simple beam bending and deflection",
 "description_for_llm": "Linear elastic (Theory I) analysis of straight beam members. Use for single beams or small beam groups spanning support to support. Assumptions: axis curves in metres, one steel section for all members, self weight active, ALMOND_IN_LOAD_KN applied as a vertical point load at every model node, supports at ALMOND_IN_SUPPORTS (the validator supplies the lowest-Z nodes when the caller does not - for a horizontal beam that pins every node, so pass explicit end supports for a true bending check). Limits: no per-element utilization output, so the validator's strength check falls back to deflection and L/250; no lateral-torsional buckling check. HARNESSED 2026-08-30 from 01_SimpleBeam.ghx via GH_IO XML surgery (tools/harness_frame_capsule.py documents the recipe).",
 "inputs": [
  {
   "name": "ALMOND_IN_LINES",
   "type": "curve[]",
   "units": "m",
   "required": true,
   "description": "Beam axis curves, node-merged at shared endpoints."
  },
  {
   "name": "ALMOND_IN_LOAD_KN",
   "type": "number",
   "units": "kN",
   "required": false,
   "default": 10.0,
   "description": "Vertical point load in kN applied at every model node (Unit-Z factor)."
  },
  {
   "name": "ALMOND_IN_SUPPORTS",
   "type": "point[]",
   "units": "m",
   "required": false,
   "description": "Support node positions. When omitted the validator supplies the lowest-Z nodes; for horizontal beams pass the end points explicitly."
  }
 ],
 "outputs": [
  {
   "name": "ALMOND_OUT_DISP_MM",
   "type": "number",
   "units": "cm",
   "semantics": "max_nodal_displacement",
   "description": "Largest nodal displacement; Karamba's Analyse emits centimetres, converted downstream per these units."
  },
  {
   "name": "ALMOND_OUT_MASS_KG",
   "type": "number",
   "units": "kg",
   "semantics": "total_mass",
   "description": "Total structural mass of the model."
  }
 ],
 "binding": "reserved_nicknames",
 "confidence": "template",
 "audited": true
}